{
  "schema_version": "0.1.0",
  "orbital_record_id": "ORB-CAT-CLEAR-MID",
  "subject_id": "CAT-CLEAR-MID",
  "subject_id_type": "canonical_object_id",
  "timestamp": "2026-07-27T18:59:30Z",
  "coordinate_frame": "ECI",
  "position_km": [6636.1, 1045.2, -421.7],
  "velocity_km_s": [-1.08, 7.31, 1.42],
  "source": "PROTOTYPE_CATALOG",
  "derivation": {"method": "sgp4", "version": "prototype-0.1"}
}
