{
  "schema_version": "0.1.0",
  "orbital_record_id": "ORB-CAT-AMBIGUOUS-NEAR",
  "subject_id": "CAT-AMBIGUOUS-NEAR",
  "subject_id_type": "canonical_object_id",
  "timestamp": "2026-07-27T18:59:30Z",
  "coordinate_frame": "ECI",
  "position_km": [6628.0, 1045.3, -421.6],
  "velocity_km_s": [-1.081, 7.309, 1.421],
  "source": "PROTOTYPE_CATALOG",
  "derivation": {"method": "sgp4", "version": "prototype-0.1"}
}
